<?xml version="1.0" encoding="UTF-8" standalone="no"?><stm:Leagues xmlns:stm="http://personales.unican.es/sanchezbp/SportTeamMng" xmlns:xsi="http://www.w3.org/2001/XMLSchema-instance" xsi:schemaLocation="http://personales.unican.es/sanchezbp/SportTeamMng ../../../../../../../../resources/SportTeamMng.xsd ">
	<stm:sport>
		<stm:name>Futbol</stm:name>
		<stm:pointsPerWin>3</stm:pointsPerWin>
		<stm:pointsPerTie>1</stm:pointsPerTie>
		<stm:pointsPerDefeat>0</stm:pointsPerDefeat>
	</stm:sport>
	<stm:sport>
		<stm:name>Baloncesto</stm:name>
		<stm:pointsPerWin>2</stm:pointsPerWin>
		<stm:pointsPerTie>0</stm:pointsPerTie>
		<stm:pointsPerDefeat>0</stm:pointsPerDefeat>
	</stm:sport>
	
</stm:Leagues>